{
  "schemaVersion": "loreweaver.survivor-horde-capability-suite.v1",
  "fixtureSuiteId": "survivor_horde.node2_12.migration",
  "sourceWorkspace": "data/workspaces/20260611-060754-719406",
  "deterministicPolicy": {
    "seedPerFixture": true,
    "fixedDeltaMs": 16.666667,
    "randomSource": "injected",
    "compare": "business_state_and_semantic_events"
  },
  "knownDefects": [
    {
      "id": "node5.frame_random_retarget",
      "nodes": [5],
      "legacySymptom": "Target selection is sampled from Math.random inside update, so pathing changes with frame rate.",
      "migrationRule": "Choose a target only on a seeded director decision beat or an explicit state transition."
    },
    {
      "id": "node8.undefined_combat_difficulty",
      "nodes": [8],
      "legacySymptom": "The combat route omits diff and assigns undefined to the active difficulty multiplier.",
      "migrationRule": "Every route variant must pass schema validation with an explicit finite difficulty multiplier."
    },
    {
      "id": "node8.duplicate_reward_field",
      "nodes": [8],
      "legacySymptom": "The combat route object declares reward twice.",
      "migrationRule": "Reject duplicate JSON or source keys during catalog compilation; store one explicit reward multiplier."
    },
    {
      "id": "node9.frame_random_retarget",
      "nodes": [9],
      "legacySymptom": "Escort targeting is sampled every update, producing frame-rate-dependent enemy intent.",
      "migrationRule": "Use seeded threat selection at spawn, reacquire, or a fixed decision cadence."
    },
    {
      "id": "shared.hardcoded_world_geometry",
      "nodes": [2, 4, 5, 8, 9, 10, 12],
      "legacySymptom": "World positions and distances are embedded as scene pixel constants.",
      "migrationRule": "Store normalized anchors and typed gameplay knobs; resolve pixels through the host viewport."
    },
    {
      "id": "shared.unregistered_lifecycle_handles",
      "nodes": [2, 3, 4, 5, 6, 7, 8, 9, 10, 11, 12],
      "legacySymptom": "Timers, overlaps, input handlers, and transient objects are not uniformly registered with one lifecycle owner.",
      "migrationRule": "All timers, tweens, listeners, colliders, projectiles, and delayed callbacks must be owned and destroyed by the adapter lifecycle."
    },
    {
      "id": "node12.untelegraphed_pattern_bullets",
      "nodes": [12],
      "legacySymptom": "Phase bullets can spawn directly from a timer without a matching semantic windup event.",
      "migrationRule": "Every damaging pattern requires accepted windup, telegraph, active, recovery, and hit policy states."
    }
  ],
  "nodes": [
    {
      "nodeId": 2,
      "fixtureId": "survivor_horde.node2.risk_treasure",
      "seed": "node2-risk-treasure-001",
      "objective": "Channel a required number of risk-tier objectives while surviving guard pressure, then resolve the climax encounter.",
      "playerDecisions": [
        "Choose safe, medium, or high risk objectives.",
        "Commit to position long enough to finish the channel or disengage before damage pressure compounds."
      ],
      "risks": [
        "Higher tiers require longer channel time.",
        "Accepted player damage regresses progress.",
        "High-risk progress triggers a one-time guard response."
      ],
      "counters": [
        "Clear or control nearby threats before committing.",
        "Leave and re-enter intentionally when continued channeling is unsafe."
      ],
      "victory": { "mode": "objective_then_boss", "requiredOpened": 3, "bossRequired": true },
      "failure": { "conditions": ["player_hp_zero"] },
      "rewardImpact": { "riskMultipliers": { "safe": 1, "mid": 2, "high": 3 }, "awardExactlyOnce": true },
      "encounter": { "bossPhases": 3, "highRiskGuardThreshold": 0.25, "highRiskGuardCount": 3 },
      "presentation": {
        "vfxKinds": ["channel_progress", "guard_alert", "objective_complete"],
        "sfxKinds": ["channel_interrupt", "guard_alert", "objective_complete"],
        "calloutKinds": ["risk_tier", "channel_interrupted", "objective_progress"]
      },
      "testHooks": ["channel.state", "channel.progress_ms", "opened_count", "high_risk_opened", "guards_spawned", "total_reward"],
      "lifecycleResources": ["channel_system", "progress_graphic", "objective_group", "guard_entities", "damage_subscription"],
      "migrationClassification": [
        {
          "capability": "proximity_channel",
          "destination": "core_primitive",
          "targetId": "channel_interaction_system",
          "rationale": "Channel, leave, damage, pause, completion, and idempotence are reusable beyond treasure."
        },
        {
          "capability": "risk_tier_treasure",
          "destination": "existing_modifier_enhancement",
          "targetId": "treasure_chest_horde",
          "rationale": "Enhance the registered modifier rather than introducing a competing treasure implementation."
        },
        {
          "capability": "risk_sequence_and_rewards",
          "destination": "node_instance_config",
          "targetId": "node_gameplay_knobs",
          "rationale": "Tier order, count, durations, and rewards are authored per node."
        }
      ],
      "sourceAnchors": ["this.chestsTotal", "Taking damage interrupts channel"],
      "inputTimeline": [
        { "atMs": 0, "action": "enter_high_risk_objective", "args": {} },
        { "atMs": 900, "action": "accept_player_damage", "args": { "amount": 5 } },
        { "atMs": 1500, "action": "leave_objective_range", "args": {} },
        { "atMs": 2000, "action": "enter_high_risk_objective", "args": {} },
        { "atMs": 5400, "action": "resolve_channel", "args": {} }
      ],
      "checkpoints": [
        { "atMs": 1000, "id": "damage_regresses", "expected": { "lastInterruptReason": "damage", "progressRegressed": true } },
        { "atMs": 3000, "id": "guards_once", "expected": { "guardsSpawned": 3, "duplicateSpawns": 0 } },
        { "atMs": 5500, "id": "reward_once", "expected": { "openedCount": 1, "rewardMultiplier": 3, "presentationCount": 1 } }
      ],
      "excludedLegacyBehavior": ["shared.hardcoded_world_geometry", "shared.unregistered_lifecycle_handles"]
    },
    {
      "nodeId": 3,
      "fixtureId": "survivor_horde.node3.pressure_break",
      "seed": "node3-pressure-break-001",
      "objective": "Manage a rising pressure meter by landing successful attacks and breaking readable boss moves.",
      "playerDecisions": [
        "Trade aggression against a rising failure meter.",
        "Reserve burst or interrupt tools for explicit break windows."
      ],
      "risks": ["Pressure rises passively.", "Taking damage spikes pressure.", "Maximum pressure fails the node."],
      "counters": ["Successful damage reduces pressure.", "Accepted break actions create a larger pressure recovery."],
      "victory": { "mode": "boss_defeat", "bossRequired": true },
      "failure": { "conditions": ["player_hp_zero", "pressure_max"] },
      "rewardImpact": { "breakPerformanceTracked": true },
      "encounter": { "bossPhases": 3, "requiresBreakWindow": true, "rangedPressureFromPhase": 2 },
      "presentation": {
        "vfxKinds": ["pressure_meter", "enemy_windup", "boss_break"],
        "sfxKinds": ["pressure_warning", "enemy_windup", "boss_break"],
        "calloutKinds": ["pressure_critical", "break_window", "boss_move"]
      },
      "testHooks": ["pressure", "boss_state", "boss_phase", "last_break_result", "damage_taken"],
      "lifecycleResources": ["pressure_meter", "pressure_tick", "boss_projectiles", "boss_phase_controller"],
      "migrationClassification": [
        {
          "capability": "pressure_meter",
          "destination": "existing_modifier_enhancement",
          "targetId": "pressure_meter",
          "rationale": "The existing pressure modifier should receive damage, hit, and break events through public context APIs."
        },
        {
          "capability": "boss_break_window",
          "destination": "core_primitive",
          "targetId": "enemy_ability_state_machine",
          "rationale": "Breakability belongs to accepted enemy move state, not a node-specific timer."
        }
      ],
      "sourceAnchors": ["Successful hits and breaks reduce pressure", "this.endGame(false, '威压爆表'"],
      "inputTimeline": [
        { "atMs": 0, "action": "set_pressure", "args": { "value": 60 } },
        { "atMs": 500, "action": "accept_player_damage", "args": { "amount": 10 } },
        { "atMs": 1500, "action": "start_enemy_move", "args": { "moveId": "boss_charge" } },
        { "atMs": 1800, "action": "interrupt_boss", "args": { "during": "break_window" } }
      ],
      "checkpoints": [
        { "atMs": 600, "id": "damage_spikes_pressure", "expected": { "pressureGreaterThan": 60 } },
        { "atMs": 1900, "id": "break_reduces_pressure", "expected": { "lastBreakAccepted": true, "pressureReduced": true } }
      ],
      "excludedLegacyBehavior": ["shared.unregistered_lifecycle_handles"]
    },
    {
      "nodeId": 4,
      "fixtureId": "survivor_horde.node4.displacement_hazard",
      "seed": "node4-displacement-hazard-001",
      "objective": "Survive persistent displacement hazards while preserving safe positioning for combat.",
      "playerDecisions": ["Read the warning area before committing to an attack line.", "Use safe lanes to recover after forced displacement."],
      "risks": ["Hazards pull the player off the chosen route.", "Remaining inside the active area causes chip damage."],
      "counters": ["Move during the warning phase.", "Recover in space clear of active hazards."],
      "victory": { "mode": "survive_then_boss", "bossRequired": true },
      "failure": { "conditions": ["player_hp_zero"] },
      "rewardImpact": { "safeLaneRecoveryTracked": true },
      "encounter": { "hazardStates": ["warning", "active", "expired"], "bossPhases": 3 },
      "presentation": {